Item Title,Publication Title,Book Series Title,Journal Volume,Journal Issue,Item DOI,Authors,Publication Year,URL,Content Type
"Round-Optimal Secure Multi-Party Computation","Advances in Cryptology – CRYPTO 2018","","","","10.1007/978-3-319-96881-0_17","Shai HaleviCarmit HazayAntigoni PolychroniadouMuthuramakrishnan Venkitasubramaniam","2018","http://link.springer.com/chapter/10.1007/978-3-319-96881-0_17","Chapter"
"Modeling Tourism Using Spatial Analysis Based on Social Media Big Data: A Review","Computational Science and Technology","","","","10.1007/978-981-33-4069-5_36","Zhu ChenRayner AlfredOliver Valentine Eboy","2021","http://link.springer.com/chapter/10.1007/978-981-33-4069-5_36","Chapter"
"Utilizing Facebook for professional integration of three ethnic groups in Israel","AI & SOCIETY","","","","10.1007/s00146-020-01131-7","Maayan Zhitomirsky-GeffetAvraham Weic","2021","http://link.springer.com/article/10.1007/s00146-020-01131-7","Article"
"Provably Insecure Group Authentication: Not All Security Proofs are What they Claim to Be","Security and Privacy","","","","10.1007/978-981-33-6781-4_13","Chris J Mitchell","2021","http://link.springer.com/chapter/10.1007/978-981-33-6781-4_13","Chapter"
"Multi-stream Progressive Up-Sampling Network for Dense CT Image Reconstruction","Medical Image Computing and Computer Assisted Intervention – MICCAI 2020","","","","10.1007/978-3-030-59725-2_50","Qiuyue LiuZhen ZhouFeng LiuXiangming FangYizhou YuYizhou Wang","2020","http://link.springer.com/chapter/10.1007/978-3-030-59725-2_50","Chapter"
"Examining the Capability of GANs to Replace Real Biomedical Images in Classification Models Training","Pattern Recognition and Information Processing","","","","10.1007/978-3-030-35430-5_9","Vassili KovalevSiarhei Kazlouski","2019","http://link.springer.com/chapter/10.1007/978-3-030-35430-5_9","Chapter"
"Synthetic Sample Selection via Reinforcement Learning","Medical Image Computing and Computer Assisted Intervention – MICCAI 2020","","","","10.1007/978-3-030-59710-8_6","Jiarong YeYuan XueL. Rodney LongSameer AntaniZhiyun XueKeith C. ChengXiaolei Huang","2020","http://link.springer.com/chapter/10.1007/978-3-030-59710-8_6","Chapter"
"Disentangled Representation Learning of Makeup Portraits in the Wild","International Journal of Computer Vision","","128","8 - 9","10.1007/s11263-019-01267-0","Yi LiHuaibo HuangJie CaoRan HeTieniu Tan","2020","http://link.springer.com/article/10.1007/s11263-019-01267-0","Article"
"AI Foundations","Implementing AI Systems","","","","10.1007/978-1-4842-6385-3_2","Tom Taulli","2021","http://link.springer.com/chapter/10.1007/978-1-4842-6385-3_2","Chapter"
"On the infeasibility of modeling polymorphic shellcode","Machine Learning","","81","2","10.1007/s10994-009-5143-5","Yingbo SongMichael E. LocastoAngelos StavrouAngelos D. KeromytisSalvatore J. Stolfo","2010","http://link.springer.com/article/10.1007/s10994-009-5143-5","Article"
"The SmarterContext Ontology and Its Application to the Smart Internet: A Smarter Commerce Case Study","The Personal Web","","","","10.1007/978-3-642-39995-4_8","Norha M. VillegasHausi A. Müller","2013","http://link.springer.com/chapter/10.1007/978-3-642-39995-4_8","Chapter"
"Predicted Robustness as QoS for Deep Neural Network Models","Journal of Computer Science and Technology","","35","5","10.1007/s11390-020-0482-6","Yue-Huan WangZe-Nan LiJing-Wei XuPing YuTaolue ChenXiao-Xing Ma","2020","http://link.springer.com/article/10.1007/s11390-020-0482-6","Article"
"Projective clustering ensembles","Data Mining and Knowledge Discovery","","26","3","10.1007/s10618-012-0266-x","Francesco GulloCarlotta DomeniconiAndrea Tagarelli","2013","http://link.springer.com/article/10.1007/s10618-012-0266-x","Article"
"Evaluation of Inpainting and Augmentation for Censored Image Queries","International Journal of Computer Vision","","129","4","10.1007/s11263-020-01403-1","Samuel BlackSomayeh KeshavarzRichard Souvenir","2021","http://link.springer.com/article/10.1007/s11263-020-01403-1","Article"
"Social Media in Higher Education: A Review of Their Uses, Benefits and Limitations","Technology in Education. Innovations for Online Teaching and Learning","","","","10.1007/978-981-33-4594-2_21","Kam Cheong LiBilly Tak-Ming Wong","2020","http://link.springer.com/chapter/10.1007/978-981-33-4594-2_21","Chapter"
"Multi-agent planning as search for a consensus that maximizes social welfare","Artificial Social Systems","","","","10.1007/3-540-58266-5_12","Eithan EphratiJeffrey S. Rosenschein","1994","http://link.springer.com/chapter/10.1007/3-540-58266-5_12","Chapter"
"The Inclusive Images Competition","The NeurIPS '18 Competition","","","","10.1007/978-3-030-29135-8_6","James AtwoodYoni HalpernPallavi BaljekarEric BreckD. SculleyPavel OstyakovSergey I. NikolenkoIgor IvanovRoman SolovyevWeimin WangMiha Skalic","2020","http://link.springer.com/chapter/10.1007/978-3-030-29135-8_6","Chapter"
"Adversarial Machine Learning: A Literature Review","Machine Learning and Data Mining in Pattern Recognition","","","","10.1007/978-3-319-96136-1_26","Sam ThomasNasseh Tabrizi","2018","http://link.springer.com/chapter/10.1007/978-3-319-96136-1_26","Chapter"
"Echocardiography Segmentation by Quality Translation Using Anatomically Constrained CycleGAN","Medical Image Computing and Computer Assisted Intervention – MICCAI 2019","","","","10.1007/978-3-030-32254-0_73","Mohammad H. JafariZhibin LiaoHany GirgisMehran PesteieRobert RohlingKen GinTerasa TsangPurang Abolmaesumi","2019","http://link.springer.com/chapter/10.1007/978-3-030-32254-0_73","Chapter"
"Deep Residual Neural Network for Child’s Spontaneous Facial Expressions Recognition","Structural, Syntactic, and Statistical Pattern Recognition","","","","10.1007/978-3-030-73973-7_27","Abdul QayyumImran Razzak","2021","http://link.springer.com/chapter/10.1007/978-3-030-73973-7_27","Chapter"
"OfGAN: Realistic Rendition of Synthetic Colonoscopy Videos","Medical Image Computing and Computer Assisted Intervention – MICCAI 2020","","","","10.1007/978-3-030-59716-0_70","Jiabo XuSaeed AnwarNick BarnesFlorian GrimpenOlivier SalvadoStuart AndersonMohammad Ali Armin","2020","http://link.springer.com/chapter/10.1007/978-3-030-59716-0_70","Chapter"
"Narratives, Formalism, Computational Tools, and Nonlinearity","Language, Culture, Computation. Computing of the Humanities, Law, and Narratives","","","","10.1007/978-3-642-45324-3_11","Ephraim Nissan","2014","http://link.springer.com/chapter/10.1007/978-3-642-45324-3_11","Chapter"
"Fundamentals of Artificial Intelligence","Edge AI","","","","10.1007/978-981-15-6186-3_3","Xiaofei WangYiwen HanVictor C. M. LeungDusit NiyatoXueqiang YanXu Chen","2020","http://link.springer.com/chapter/10.1007/978-981-15-6186-3_3","Chapter"
"Learning opponent’s preferences for effective negotiation: an approach based on concept learning","Autonomous Agents and Multi-Agent Systems","","24","1","10.1007/s10458-010-9147-0","Reyhan AydoğanPınar Yolum","2012","http://link.springer.com/article/10.1007/s10458-010-9147-0","Article"
"Small Codes for Big Signals","Applied Machine Learning","","","","10.1007/978-3-030-18114-7_19","David Forsyth","2019","http://link.springer.com/chapter/10.1007/978-3-030-18114-7_19","Chapter"
"Computation And Communication Efficient Chinese Remainder Theorem Based Multi-Party Key Generation Using Modified RSA","Security and Privacy","","","","10.1007/978-981-33-6781-4_3","Arjun Singh RawatMaroti Deshmukh","2021","http://link.springer.com/chapter/10.1007/978-981-33-6781-4_3","Chapter"
"Health Monitoring of Hydraulic System Using Feature-based Multivariate Time-series Classification Model","Security and Privacy","","","","10.1007/978-981-33-6781-4_7","Ananda Shivani MedishettyNavya Sahithi MuthavarapuSai Goutham GoliB SirishaB Sandhya","2021","http://link.springer.com/chapter/10.1007/978-981-33-6781-4_7","Chapter"
"Iris Recognition Using Improved Xor-Sum Code","Security and Privacy","","","","10.1007/978-981-33-6781-4_9","Neeru BalaRitesh VyasRashmi GuptaAnil Kumar","2021","http://link.springer.com/chapter/10.1007/978-981-33-6781-4_9","Chapter"
"Linear Complementary Dual Codes Over 
            
              
            
            $$\mathbb {Z}_2\mathbb {Z}_4$$
            
              
                
                  Z
                  2
                
                
                  Z
                  4","Security and Privacy","","","","10.1007/978-981-33-6781-4_10","Sanjit BhowmickSatya BagchiRamakrishna Bandi","2021","http://link.springer.com/chapter/10.1007/978-981-33-6781-4_10","Chapter"
"Terahertz Communication: Merits, Demerits, and Future Challenges Regarding 6G Wireless Networks","Security and Privacy","","","","10.1007/978-981-33-6781-4_14","NiraAasheesh Shukla","2021","http://link.springer.com/chapter/10.1007/978-981-33-6781-4_14","Chapter"
"Efficient Random Grid Visual Cryptographic Schemes having Essential Members","Security and Privacy","","","","10.1007/978-981-33-6781-4_4","Bibhas Chandra DasMd Kutubuddin SardarAvishek Adhikari","2021","http://link.springer.com/chapter/10.1007/978-981-33-6781-4_4","Chapter"
"Generalization of Lattice-Based Cryptography on Hypercomplex Algebras","Security and Privacy","","","","10.1007/978-981-33-6781-4_6","Sonika SinghSahadeo PadhyeAnkal Pal","2021","http://link.springer.com/chapter/10.1007/978-981-33-6781-4_6","Chapter"
"Image Security Using Hyperchaos and Multidimensional Playfair Cipher","Security and Privacy","","","","10.1007/978-981-33-6781-4_8","Krishnaraj BhatDindayal MahtoDilip Kumar YadavChandrashekhar Azad","2021","http://link.springer.com/chapter/10.1007/978-981-33-6781-4_8","Chapter"
"Declarative foundations of secure deductive databases","Database Theory — ICDT '92","","","","10.1007/3-540-56039-4_55","Piero BonattiSarit KrausV. S. Subrahmanian","1992","http://link.springer.com/chapter/10.1007/3-540-56039-4_55","Chapter"
"Hypervisor Memory Introspection and Hypervisor Based Malware Honeypot","Information Systems Security and Privacy","","","","10.1007/978-3-030-49443-8_15","Nezer Jacob ZaidenbergMichael KiperbergRaz Ben YehudaRoee LeonAsaf AlgawiAmit Resh","2020","http://link.springer.com/chapter/10.1007/978-3-030-49443-8_15","Chapter"
"Low c-Differential Uniformity for the Gold Function Modified on a Subfield","Security and Privacy","","","","10.1007/978-981-33-6781-4_11","Pantelimon Stănică","2021","http://link.springer.com/chapter/10.1007/978-981-33-6781-4_11","Chapter"
"Efficient Circuit-Based PSI with Linear Communication","Advances in Cryptology – EUROCRYPT 2019","","","","10.1007/978-3-030-17659-4_5","Benny PinkasThomas SchneiderOleksandr TkachenkoAvishay Yanai","2019","http://link.springer.com/chapter/10.1007/978-3-030-17659-4_5","Chapter"
"A Score-Level Fusion Method for Protecting Fingerprint and Palmprint Templates","Security and Privacy","","","","10.1007/978-981-33-6781-4_1","Mulagala SandhyaY. Sreenivasa RaoSahoo BiswajeetVallabhadas Dilip KumarMaurya Anup Kumar","2021","http://link.springer.com/chapter/10.1007/978-981-33-6781-4_1","Chapter"
"Energy efficient emergency rescue scheme in wireless sensor networks","International Journal of Information Technology","","","","10.1007/s41870-020-00584-9","Vinay RishiwalOmkar Singh","2021","http://link.springer.com/article/10.1007/s41870-020-00584-9","Article"
"Semiotic Brains and Artificial Minds","Abductive Cognition","","","","10.1007/978-3-642-03631-6_3","Lorenzo Magnani","2009","http://link.springer.com/chapter/10.1007/978-3-642-03631-6_3","Chapter"
"I-MINDS: An Agent-Oriented Information System for Applications in Education","Agent-Oriented Information Systems","","","","10.1007/978-3-540-25943-5_2","Leen-Kiat SohXuLi LiuXueSong ZhangJameela Al-JaroodiHong JiangPhanivas Vemuri","2004","http://link.springer.com/chapter/10.1007/978-3-540-25943-5_2","Chapter"
"Data Mining in Customer Value and Customer Relationship Management","Introduction to Data Mining and its Applications","","","","10.1007/978-3-540-34351-6_16","","2006","http://link.springer.com/chapter/10.1007/978-3-540-34351-6_16","Chapter"
"WATCHiT: A Modular and Wearable Tool for Data Collection in Crisis Management and Training","Ambient Intelligence","","","","10.1007/978-3-319-14112-1_22","Simone MoraMonica Divitini","2014","http://link.springer.com/chapter/10.1007/978-3-319-14112-1_22","Chapter"
"Fast Smallest Lowest Common Ancestor Computation Based on Stable Match","Journal of Computer Science and Technology","","28","2","10.1007/s11390-013-1337-1","Jun-Feng ZhouGuo-Xiang LanZi-Yang ChenXian Tang","2013","http://link.springer.com/article/10.1007/s11390-013-1337-1","Article"
"Visual Interaction Including Biometrics Information for a Socially Assistive Robotic Platform","Computer Vision - ECCV 2014 Workshops","","","","10.1007/978-3-319-16199-0_28","Pierluigi CarcagnìDario CazzatoMarco Del CocoCosimo DistanteMarco Leo","2015","http://link.springer.com/chapter/10.1007/978-3-319-16199-0_28","Chapter"
"Automating Credibility Assessment of Arabic News","Social Informatics","","","","10.1007/978-3-319-03260-3_13","Mohamed HammadElsayed Hemayed","2013","http://link.springer.com/chapter/10.1007/978-3-319-03260-3_13","Chapter"
"6. External Constraint Problem Solving","Autonomous Dynamic Reconfiguration in Multi-Agent Systems","","","","10.1007/3-540-45834-4_6","","2002","http://link.springer.com/chapter/10.1007/3-540-45834-4_6","Chapter"
"GruSMA1: Experience on the Deployment of Agent-Based Health Care Services","Applications of Software Agent Technology in the Health Care Domain","","","","10.1007/978-3-0348-7976-7_5","Antonio MorenoAïda VallsDavid IsernDavid Sánchez","2003","http://link.springer.com/chapter/10.1007/978-3-0348-7976-7_5","Chapter"
"Distributed Formal Concept Analysis Algorithms Based on an Iterative MapReduce Framework","Formal Concept Analysis","","","","10.1007/978-3-642-29892-9_26","Biao XuRuairí de FréinEric RobsonMícheál Ó Foghlú","2012","http://link.springer.com/chapter/10.1007/978-3-642-29892-9_26","Chapter"
"A User-Oriented GIS Search Service Using Ontology in Location-Based Services","Advances in Hybrid Information Technology","","","","10.1007/978-3-540-77368-9_21","Hyunsuk HwangSeonghyun ShinChangsoo Kim","2007","http://link.springer.com/chapter/10.1007/978-3-540-77368-9_21","Chapter"
"A Signature Scheme for Distributed Executions Based on Control Flow Analysis","Security and Intelligent Information Systems","","","","10.1007/978-3-642-25261-7_7","Sébastien VarretteBenoît BertholonPascal Bouvry","2012","http://link.springer.com/chapter/10.1007/978-3-642-25261-7_7","Chapter"
"A mechanized logic for secure key escrow protocol verification","Higher Order Logic Theorem Proving and Its Applications","","","","10.1007/3-540-60275-5_73","Tom SchubertSarah Mocas","1995","http://link.springer.com/chapter/10.1007/3-540-60275-5_73","Chapter"
"A Survey of Artificial Intelligence Techniques on MOOC of Legal Education","Technology-Inspired Smart Learning for Future Education","","","","10.1007/978-981-15-5390-5_3","Yang WengXuejiao LiangHanyan DuanSongyuan GuNing WangZhu Wang","2020","http://link.springer.com/chapter/10.1007/978-981-15-5390-5_3","Chapter"
"Autoencoder-based image processing framework for object appearance modifications","Neural Computing and Applications","","33","4","10.1007/s00521-020-04976-7","Krzysztof ŚlotPaweł KapustaJacek Kucharski","2021","http://link.springer.com/article/10.1007/s00521-020-04976-7","Article"
"Deployment and Monitoring","Implementing AI Systems","","","","10.1007/978-1-4842-6385-3_7","Tom Taulli","2021","http://link.springer.com/chapter/10.1007/978-1-4842-6385-3_7","Chapter"
"A Semi-supervised Framework with Efficient Feature Extraction and Network Alignment for User Identity Linkage","Database Systems for Advanced Applications","","","","10.1007/978-3-030-73197-7_46","Zehua HuJiahai WangSiyuan ChenXin Du","2021","http://link.springer.com/chapter/10.1007/978-3-030-73197-7_46","Chapter"
"Controlled Query Evaluation for Known Policies by Combining Lying and Refusal","Annals of Mathematics and Artificial Intelligence","","40","1 - 2","10.1023/A:1026106029043","Joachim BiskupPiero A. Bonatti","2004","http://link.springer.com/article/10.1023/A%3A1026106029043","Article"
"A Study of Detecting Computer Viruses in Real-Infected Files in the n-Gram Representation with Machine Learning Methods","Trends in Applied Intelligent Systems","","","","10.1007/978-3-642-13022-9_51","Thomas Stibor","2010","http://link.springer.com/chapter/10.1007/978-3-642-13022-9_51","Chapter"
"A Characterization of Key Properties of Environment-Mediated Multiagent Systems","Engineering Environment-Mediated Multi-Agent Systems","","","","10.1007/978-3-540-85029-8_3","Hartmut SchmeckChristian Müller-Schloer","2008","http://link.springer.com/chapter/10.1007/978-3-540-85029-8_3","Chapter"
"A New Service Mining Method Based on Semantic Process","Advances in Information Technology and Education","","","","10.1007/978-3-642-22418-8_2","Xin-wei ZhaiDe-gan Zhang","2011","http://link.springer.com/chapter/10.1007/978-3-642-22418-8_2","Chapter"
"Target Identity Attacks on Facial Recognition Systems","Advances in Digital Forensics XVI","","","","10.1007/978-3-030-56223-6_13","Saheb ChhabraNaman BanatiGaurav GuptaGarima Gupta","2020","http://link.springer.com/chapter/10.1007/978-3-030-56223-6_13","Chapter"
"A Bibliometric Analysis on the Application of Deep Learning in Cybersecurity","Security of Cyber-Physical Systems","","","","10.1007/978-3-030-45541-5_11","Sanaz NakhodchiAli Dehghantanha","2020","http://link.springer.com/chapter/10.1007/978-3-030-45541-5_11","Chapter"
"Aiming AI at a moving target: health (or disease)","AI & SOCIETY","","35","4","10.1007/s00146-020-00943-x","Mihai Nadin","2020","http://link.springer.com/article/10.1007/s00146-020-00943-x","Article"
"Ringer: Systematic Mining of Malicious Domains by Dynamic Graph Convolutional Network","Computational Science – ICCS 2020","","","","10.1007/978-3-030-50420-5_28","Zhicheng LiuShuhao LiYongzheng ZhangXiaochun YunChengwei Peng","2020","http://link.springer.com/chapter/10.1007/978-3-030-50420-5_28","Chapter"
"Understanding deep face anti-spoofing: from the perspective of data","The Visual Computer","","","","10.1007/s00371-020-01849-x","Yujing SunHao XiongSiu Ming Yiu","2020","http://link.springer.com/article/10.1007/s00371-020-01849-x","Article"
"A heuristic technique for multi‐agent planning","Annals of Mathematics and Artificial Intelligence","","20","1 - 4","10.1023/A:1018924209812","Eithan EphratiJeffrey S. Rosenschein","1997","http://link.springer.com/article/10.1023/A%3A1018924209812","Article"
"A Cross-Platform Benchmark Framework for Mobile Semantic Web Reasoning Engines","The Semantic Web – ISWC 2014","","","","10.1007/978-3-319-11964-9_25","William Van WoenselNewres Al HaiderAhmad AhmadSyed S. R. Abidi","2014","http://link.springer.com/chapter/10.1007/978-3-319-11964-9_25","Chapter"
"A Self-organizing Sensing System for Structural Health Monitoring of Aerospace Vehicles","Advances in Applied Self-organizing Systems","","","","10.1007/978-1-84628-982-8_4","N. HoschkeC. J. LewisD. C. PriceD. A. ScottV. GerasimovP. Wang","2008","http://link.springer.com/chapter/10.1007/978-1-84628-982-8_4","Chapter"
"A 3D Human Posture Approach for Activity Recognition Based on Depth Camera","Computer Vision – ECCV 2016 Workshops","","","","10.1007/978-3-319-48881-3_30","Alessandro ManziFilippo CavalloPaolo Dario","2016","http://link.springer.com/chapter/10.1007/978-3-319-48881-3_30","Chapter"
"Geographic Visualization","Human-Centered Visualization Environments","","","","10.1007/978-3-540-71949-6_6","Martin Nöllenburg","2007","http://link.springer.com/chapter/10.1007/978-3-540-71949-6_6","Chapter"
"Visual Social Relationship Recognition","International Journal of Computer Vision","","128","6","10.1007/s11263-020-01295-1","Junnan LiYongkang WongQi ZhaoMohan S. Kankanhalli","2020","http://link.springer.com/article/10.1007/s11263-020-01295-1","Article"
"Secure Agents","Annals of Mathematics and Artificial Intelligence","","37","1 - 2","10.1023/A:1020233522878","Piero A. BonattiSarit KrausV.S. Subrahmanian","2003","http://link.springer.com/article/10.1023/A%3A1020233522878","Article"
"Processing Systems for Deep Learning Inference on Edge Devices","Convergence of Artificial Intelligence and the Internet of Things","","","","10.1007/978-3-030-44907-0_9","Mário Véstias","2020","http://link.springer.com/chapter/10.1007/978-3-030-44907-0_9","Chapter"
"Enhancing Security of FPGA-Based Embedded Systems with Combinational Logic Binding","Journal of Computer Science and Technology","","32","2","10.1007/s11390-017-1700-8","Ji-Liang ZhangWei-Zheng WangXing-Wei WangZhi-Hua Xia","2017","http://link.springer.com/article/10.1007/s11390-017-1700-8","Article"
"Video Anomaly Detection for Smart Surveillance","Computer Vision","","","","10.1007/978-3-030-03243-2_845-1","Sijie ZhuChen ChenWaqas Sultani","2020","http://link.springer.com/referenceworkentry/10.1007/978-3-030-03243-2_845-1","ReferenceWorkEntry"
"A distributable event-oriented architecture for activity recognition in smart homes","Journal of Reliable Intelligent Environments","","","","10.1007/s40860-020-00125-y","Cédric DemongivertKévin BouchardSébastien GabouryBruno BouchardMaxime LussierMaxime ParenteauCatherine LalibertéMélanie CoutureNathalie BierSylvain Giroux","2021","http://link.springer.com/article/10.1007/s40860-020-00125-y","Article"
"State of the Art of Non-vision-Based Localization Technologies for AR in Facility Management","Augmented Reality, Virtual Reality, and Computer Graphics","","","","10.1007/978-3-030-58465-8_20","Dietmar SiegeleUmberto Di StasoMarco PiovanoCarmen MarcherDominik T. Matt","2020","http://link.springer.com/chapter/10.1007/978-3-030-58465-8_20","Chapter"
"Evading Deep Neural Network and Random Forest Classifiers by Generating Adversarial Samples","Foundations and Practice of Security","","","","10.1007/978-3-030-18419-3_10","Erick Eduardo Bernal MartinezBella OhFeng LiXiao Luo","2019","http://link.springer.com/chapter/10.1007/978-3-030-18419-3_10","Chapter"
"Interpretability of Fuzzy Systems","Fuzzy Logic and Applications","","","","10.1007/978-3-319-03200-9_3","Corrado Mencar","2013","http://link.springer.com/chapter/10.1007/978-3-319-03200-9_3","Chapter"
"A New Ridge-Features-Based Method for Fingerprint Image Quality Assessment","Progress in Pattern Recognition, Image Analysis, Computer Vision, and Applications","","","","10.1007/978-3-319-25751-8_26","Katy Castillo-RosadoJosé Hernández-Palancar","2015","http://link.springer.com/chapter/10.1007/978-3-319-25751-8_26","Chapter"
"An Identity-Based Threshold Signcryption Scheme with Semantic Security","Computational Intelligence and Security","","","","10.1007/11596981_26","Changgen PengXiang Li","2005","http://link.springer.com/chapter/10.1007/11596981_26","Chapter"
"Design of Public Practical Training Service Platform Based on Cloud Computing for Students Majoring in Software","Recent Progress in Data Engineering and Internet Technology","","","","10.1007/978-3-642-28798-5_70","Jing TangWen-ai Song","2012","http://link.springer.com/chapter/10.1007/978-3-642-28798-5_70","Chapter"
"An Empathy Imitation Game: Empathy Turing Test for Care- and Chat-bots","Minds and Machines","","","","10.1007/s11023-021-09555-w","Jeremy HowickJessica MorleyLuciano Floridi","2021","http://link.springer.com/article/10.1007/s11023-021-09555-w","Article"
"Agent-Based Approach to Conference Information Management","Knowledge-Based Intelligent Information and Engineering Systems","","","","10.1007/978-3-540-30134-9_105","Hee-Seop HanJae-Bong KimSun-Gwan HanHyeoncheol Kim","2004","http://link.springer.com/chapter/10.1007/978-3-540-30134-9_105","Chapter"
"HEDC++: An Extended Histogram Estimator for Data in the Cloud","Journal of Computer Science and Technology","","28","6","10.1007/s11390-013-1392-7","Ying-Jie ShiXiao-Feng MengFusheng WangYan-Tao Gan","2013","http://link.springer.com/article/10.1007/s11390-013-1392-7","Article"
"A New Virus-Antivirus Spreading Model","Advances in Neural Networks – ISNN 2015","","","","10.1007/978-3-319-25393-0_53","Bei LiuChuandong Li","2015","http://link.springer.com/chapter/10.1007/978-3-319-25393-0_53","Chapter"
"A Distributed Multi-secret Sharing Scheme on the (t,n) Threshold","Network Computing and Information Security","","","","10.1007/978-3-642-35211-9_47","Guiqiang ChenHuanwen WangLiqin WangYue Jin","2012","http://link.springer.com/chapter/10.1007/978-3-642-35211-9_47","Chapter"
"Using Memory in the Right Way to Accelerate Big Data Processing","Journal of Computer Science and Technology","","30","1","10.1007/s11390-015-1502-9","Dong YanXu-Sen YinCheng LianXiang ZhongXin ZhouGan-Sha Wu","2015","http://link.springer.com/article/10.1007/s11390-015-1502-9","Article"
"A comprehensive survey: artificial bee colony (ABC) algorithm and applications","Artificial Intelligence Review","","42","1","10.1007/s10462-012-9328-0","Dervis KarabogaBeyza GorkemliCelal OzturkNurhan Karaboga","2014","http://link.springer.com/article/10.1007/s10462-012-9328-0","Article"
"Person Re-identification: Current Approaches and Future Challenges","Computer Vision","","","","10.1007/978-3-030-03243-2_825-1","Rameswar PandaAmit K. Roy-Chowdhury","2020","http://link.springer.com/referenceworkentry/10.1007/978-3-030-03243-2_825-1","ReferenceWorkEntry"
"JOURNAL OF COMPUTER SCIENCE AND TECHNOLOGY","Journal of Computer Science and Technology","","31","6","10.1007/s11390-016-1697-4","","2016","http://link.springer.com/article/10.1007/s11390-016-1697-4","Article"
"A jumping mining attack and solution","Applied Intelligence","","51","3","10.1007/s10489-020-01866-2","Muchuang HuJiahui ChenWensheng GanChien-Ming Chen","2021","http://link.springer.com/article/10.1007/s10489-020-01866-2","Article"
