Item Title,Publication Title,Book Series Title,Journal Volume,Journal Issue,Item DOI,Authors,Publication Year,URL,Content Type
"Privacy Preserving Synthetic Data Release Using Deep Learning","Machine Learning and Knowledge Discovery in Databases","","","","10.1007/978-3-030-10925-7_31","Nazmiye Ceren AbayYan ZhouMurat KantarciogluBhavani ThuraisinghamLatanya Sweeney","2019","http://link.springer.com/chapter/10.1007/978-3-030-10925-7_31","Chapter"
"Privacy-Protective-GAN for Privacy Preserving Face De-Identification","Journal of Computer Science and Technology","","34","1","10.1007/s11390-019-1898-8","Yifan WuFan YangYong XuHaibin Ling","2019","http://link.springer.com/article/10.1007/s11390-019-1898-8","Article"
"PART-GAN: Privacy-Preserving Time-Series Sharing","Artificial Neural Networks and Machine Learning – ICANN 2020","","","","10.1007/978-3-030-61609-0_46","Shuo WangCarsten RudolphSurya NepalMarthie GroblerShangyu Chen","2020","http://link.springer.com/chapter/10.1007/978-3-030-61609-0_46","Chapter"
"Using Deep Learning to Generate Relational HoneyData","Autonomous Cyber Deception","","","","10.1007/978-3-030-02110-8_1","Nazmiye Ceren AbayCuneyt Gurcan AkcoraYan ZhouMurat KantarciogluBhavani Thuraisingham","2019","http://link.springer.com/chapter/10.1007/978-3-030-02110-8_1","Chapter"
"A Graph Data Privacy-Preserving Method Based on Generative Adversarial Networks","Web Information Systems Engineering – WISE 2020","","","","10.1007/978-3-030-62008-0_16","Aiping LiJunbin FangQianye JiangBin ZhouYan Jia","2020","http://link.springer.com/chapter/10.1007/978-3-030-62008-0_16","Chapter"
"A Novel Location Privacy Protection Scheme with Generative Adversarial Network","Big Data and Security","","","","10.1007/978-981-15-7530-3_2","Wenxi WangWeilong ZhangZhang JinKeyan SunRunlin ZouChenrong HuangYuan Tian","2020","http://link.springer.com/chapter/10.1007/978-981-15-7530-3_2","Chapter"
"Differentially Private Obfuscation of Facial Images","Machine Learning and Knowledge Extraction","","","","10.1007/978-3-030-29726-8_15","William L. CroftJörg-Rüdiger SackWei Shi","2019","http://link.springer.com/chapter/10.1007/978-3-030-29726-8_15","Chapter"
"Privacy Sensitive Large-Margin Model for Face De-Identification","Neural Computing for Advanced Applications","","","","10.1007/978-981-15-7670-6_40","Zhiqiang GuoHuigui LiuZhenzhong KuangYuta NakashimaNoboru Babaguchi","2020","http://link.springer.com/chapter/10.1007/978-981-15-7670-6_40","Chapter"
"DAP
            
              
            
            $$^2$$
            
              
                
                2
              
            
          CMH: Deep Adversarial Privacy-Preserving Cross-Modal Hashing","Neural Processing Letters","","","","10.1007/s11063-021-10447-4","Lei ZhuJiayu SongZhan YangWenti HuangChengyuan ZhangWeiren Yu","2021","http://link.springer.com/article/10.1007/s11063-021-10447-4","Article"
"Privacy-Preserving Data Generation and Sharing Using Identification Sanitizer","Web Information Systems Engineering – WISE 2020","","","","10.1007/978-3-030-62008-0_13","Shuo WangLingjuan LyuTianle ChenShangyu ChenSurya NepalCarsten RudolphMarthie Grobler","2020","http://link.springer.com/chapter/10.1007/978-3-030-62008-0_13","Chapter"
"PLFG: A Privacy Attack Method Based on Gradients for Federated Learning","Security and Privacy in Digital Economy","","","","10.1007/978-981-15-9129-7_14","Feng Wu","2020","http://link.springer.com/chapter/10.1007/978-981-15-9129-7_14","Chapter"
"Data Privacy: From Technology to Economics","Advances in Machine Learning II","","","","10.1007/978-3-642-05179-1_3","Stan MatwinTomasz Szapiro","2010","http://link.springer.com/chapter/10.1007/978-3-642-05179-1_3","Chapter"
"A Privacy Framework for the Personal Web","The Personal Web","","","","10.1007/978-3-642-39995-4_5","Reza SamaviMariano P. ConsensThodoros Topaloglou","2013","http://link.springer.com/chapter/10.1007/978-3-642-39995-4_5","Chapter"
"Reset Attack: An Attack Against Homomorphic Encryption-Based Privacy-Preserving Deep Learning System","Artificial Intelligence and Security","","","","10.1007/978-981-15-8083-3_3","Xiaofeng WuYuanzhi YaoWeihai LiNenghai Yu","2020","http://link.springer.com/chapter/10.1007/978-981-15-8083-3_3","Chapter"
"A New Noise Generating Method Based on Gaussian Sampling for Privacy Preservation","Geometry and Vision","","","","10.1007/978-3-030-72073-5_1","Bo MaWei Qi YanEdmund LaiJingsong Wu","2021","http://link.springer.com/chapter/10.1007/978-3-030-72073-5_1","Chapter"
"Ambient Intelligence: Applications and Privacy Policies","Highlights of Practical Applications of Heterogeneous Multi-Agent Systems. The PAAMS Collection","","","","10.1007/978-3-319-07767-3_18","Mar LopezJuanita PedrazaJavier CarboJose M. Molina","2014","http://link.springer.com/chapter/10.1007/978-3-319-07767-3_18","Chapter"
"Protect privacy of deep classification networks by exploiting their generative power","Machine Learning","","","","10.1007/s10994-021-05951-6","Jiyu ChenYiwen GuoQianjun ZhengHao Chen","2021","http://link.springer.com/article/10.1007/s10994-021-05951-6","Article"
"Learning to Anonymize Faces for Privacy Preserving Action Detection","Computer Vision – ECCV 2018","","","","10.1007/978-3-030-01246-5_38","Zhongzheng RenYong Jae LeeMichael S. Ryoo","2018","http://link.springer.com/chapter/10.1007/978-3-030-01246-5_38","Chapter"
"Location-Aware Privacy Preserving Scheme in SDN-Enabled Fog Computing","Security and Privacy in Digital Economy","","","","10.1007/978-981-15-9129-7_13","Bruce GuXiaodong WangYouyang QuJiong JinYong XiangLongxiang Gao","2020","http://link.springer.com/chapter/10.1007/978-981-15-9129-7_13","Chapter"
"Analyzing and Predicting Privacy Settings in the Social Web","User Modeling, Adaptation and Personalization","","","","10.1007/978-3-319-20267-9_9","Kaweh Djafari NainiIsmail Sengor AltingovdeRicardo KawaseEelco HerderClaudia Niederée","2015","http://link.springer.com/chapter/10.1007/978-3-319-20267-9_9","Chapter"
"Task-Agnostic Privacy-Preserving Representation Learning via Federated Learning","Federated Learning","","","","10.1007/978-3-030-63076-8_4","Ang LiHuanrui YangYiran Chen","2020","http://link.springer.com/chapter/10.1007/978-3-030-63076-8_4","Chapter"
"Dynamic Searchable Symmetric Encryption with Forward and Backward Privacy: A Survey","Network and System Security","","","","10.1007/978-3-030-36938-5_3","Qingqing GanCong ZuoJianfeng WangShi-Feng SunXiaoming Wang","2019","http://link.springer.com/chapter/10.1007/978-3-030-36938-5_3","Chapter"
"The Location Privacy Preserving Scheme Based on Hilbert Curve for Indoor LBS","Advances in Swarm Intelligence","","","","10.1007/978-3-030-26354-6_39","Yanru ZhongTing WangCaijun GanXiaonan Luo","2019","http://link.springer.com/chapter/10.1007/978-3-030-26354-6_39","Chapter"
"Study on Personalized Location Privacy Preservation Algorithms Based on Road Networks","Algorithms and Architectures for Parallel Processing","","","","10.1007/978-3-319-27161-3_4","Hongyun XuJun YangYong ZhangMengzhen XuJiayi Gan","2015","http://link.springer.com/chapter/10.1007/978-3-319-27161-3_4","Chapter"
"Security and Privacy","Lecture Notes in Electrical Engineering","","","","10.1007/978-981-33-6781-4","Prof. Dr. Pantelimon StănicăProf. Sugata GangopadhyayDr. Sumit Kumar Debnath","2021","http://link.springer.com/book/10.1007/978-981-33-6781-4","Book"
"New Research and Future Directions","Introduction to Deep Learning Business Applications for Developers","","","","10.1007/978-1-4842-3453-2_11","Armando VieiraBernardete Ribeiro","2018","http://link.springer.com/chapter/10.1007/978-1-4842-3453-2_11","Chapter"
"Privacy-Preserving SVM Classification on Vertically Partitioned Data","Advances in Knowledge Discovery and Data Mining","","","","10.1007/11731139_74","Hwanjo YuJaideep VaidyaXiaoqian Jiang","2006","http://link.springer.com/chapter/10.1007/11731139_74","Chapter"
"Information Sharing System Based on Location in Consideration of Privacy for Knowledge Creation","Knowledge-Based Intelligent Information and Engineering Systems","","","","10.1007/978-3-540-30132-5_47","Toshiyuki HirataSusumu Kunifuji","2004","http://link.springer.com/chapter/10.1007/978-3-540-30132-5_47","Chapter"
"Quadratic Error Minimization in a Distributed Environment with Privacy Preserving","Privacy and Security Issues in Data Mining and Machine Learning","","","","10.1007/978-3-642-19896-0_3","Gérald GavinJulien Velcin","2011","http://link.springer.com/chapter/10.1007/978-3-642-19896-0_3","Chapter"
"A Neural-Network Clustering-Based Algorithm for Privacy Preserving Data Mining","Grid and Distributed Computing, Control and Automation","","","","10.1007/978-3-642-17625-8_27","S. TsiafoulisV. C. ZorkadisD. A. Karras","2010","http://link.springer.com/chapter/10.1007/978-3-642-17625-8_27","Chapter"
"Usability Challenges in Security and Privacy Policy-Authoring Interfaces","Human-Computer Interaction – INTERACT 2007","","","","10.1007/978-3-540-74800-7_11","Robert W. ReederClare-Marie KaratJohn KaratCarolyn Brodie","2007","http://link.springer.com/chapter/10.1007/978-3-540-74800-7_11","Chapter"
"Face Swapping for Solving Collateral Privacy Issues in Multimedia Analytics","MultiMedia Modeling","","","","10.1007/978-3-030-05710-7_14","Werner Bailer","2019","http://link.springer.com/chapter/10.1007/978-3-030-05710-7_14","Chapter"
"A Survey on Deep Learning Techniques for Privacy-Preserving","Machine Learning for Cyber Security","","","","10.1007/978-3-030-30619-9_4","Harry Chandra TanuwidjajaRakyong ChoiKwangjo Kim","2019","http://link.springer.com/chapter/10.1007/978-3-030-30619-9_4","Chapter"
"Privacy Prediction of Lightweight Convolutional Neural Network","Frontiers in Cyber Security","","","","10.1007/978-981-15-9739-8_39","Shiyin YangYongbiao LiDehua ZhouLinfeng WeiQingqing Gan","2020","http://link.springer.com/chapter/10.1007/978-981-15-9739-8_39","Chapter"
"Federated Simulation for Medical Imaging","Medical Image Computing and Computer Assisted Intervention – MICCAI 2020","","","","10.1007/978-3-030-59710-8_16","Daiqing LiAmlan KarNishant RavikumarAlejandro F. FrangiSanja Fidler","2020","http://link.springer.com/chapter/10.1007/978-3-030-59710-8_16","Chapter"
"Automatic Attendance Taking: A Proof of Concept on Privacy Concerns in 802.11 MAC Address Probing","Advances in Cyber Security","","","","10.1007/978-981-15-2693-0_20","Yichiet AunMing-Lee GanYen-Min Jasmina Khaw","2020","http://link.springer.com/chapter/10.1007/978-981-15-2693-0_20","Chapter"
"A More Secure Spatial Decompositions Algorithm via Indefeasible Laplace Noise in Differential Privacy","Advanced Data Mining and Applications","","","","10.1007/978-3-030-05090-0_19","Xiaocui LiYangtao WangXinyu ZhangKe ZhouChunhua Li","2018","http://link.springer.com/chapter/10.1007/978-3-030-05090-0_19","Chapter"
"Data Generation Using Gene Expression Generator","Intelligent Data Engineering and Automated Learning – IDEAL 2020","","","","10.1007/978-3-030-62365-4_6","Zakarya FarouNoureddine MouhoubTomáš Horváth","2020","http://link.springer.com/chapter/10.1007/978-3-030-62365-4_6","Chapter"
"Towards Automated Customer Support","Artificial Intelligence: Methodology, Systems, and Applications","","","","10.1007/978-3-319-99344-7_5","Momchil HardalovIvan KoychevPreslav Nakov","2018","http://link.springer.com/chapter/10.1007/978-3-319-99344-7_5","Chapter"
"Explanation Methods in Deep Learning: Users, Values, Concerns and Challenges","Explainable and Interpretable Models in Computer Vision and Machine Learning","","","","10.1007/978-3-319-98131-4_2","Gabriëlle RasMarcel van GervenPim Haselager","2018","http://link.springer.com/chapter/10.1007/978-3-319-98131-4_2","Chapter"
"Social Trust of Virtual Identities","Computing with Social Trust","","","","10.1007/978-1-84800-356-9_4","Jean-Marc Seigneur","2009","http://link.springer.com/chapter/10.1007/978-1-84800-356-9_4","Chapter"
"Using deep learning to preserve data confidentiality","Applied Intelligence","","50","2","10.1007/s10489-019-01515-3","Wei LiPengqiu MengYi HongXiaohui Cui","2020","http://link.springer.com/article/10.1007/s10489-019-01515-3","Article"
"Siamese Generative Adversarial Privatizer for Biometric Data","Computer Vision – ACCV 2018","","","","10.1007/978-3-030-20873-8_31","Witold OleszkiewiczPeter KairouzKarol PiczakRam RajagopalTomasz Trzciński","2019","http://link.springer.com/chapter/10.1007/978-3-030-20873-8_31","Chapter"
"Deep learning for face image synthesis and semantic manipulations: a review and future perspectives","Artificial Intelligence Review","","53","8","10.1007/s10462-020-09835-4","Mahla AbdolahnejadPeter Xiaoping Liu","2020","http://link.springer.com/article/10.1007/s10462-020-09835-4","Article"
"A Feature Filter for EEG Using Cycle-GAN Structure","Neural Information Processing","","","","10.1007/978-3-030-04239-4_51","Yue YaoJo PlestedTom Gedeon","2018","http://link.springer.com/chapter/10.1007/978-3-030-04239-4_51","Chapter"
"Synthesizing Quality Open Data Assets from Private Health Research Studies","Business Information Systems Workshops","","","","10.1007/978-3-030-61146-0_26","Andrew YaleSaloni DashKaran BhanotIsabelle GuyonJohn S. EricksonKristin P. Bennett","2020","http://link.springer.com/chapter/10.1007/978-3-030-61146-0_26","Chapter"
"SPEED: secure, PrivatE, and efficient deep learning","Machine Learning","","","","10.1007/s10994-021-05970-3","Arnaud Grivet SébertRafaël PinotMartin ZuberCédric Gouy-PaillerRenaud Sirdey","2021","http://link.springer.com/article/10.1007/s10994-021-05970-3","Article"
"SMOOTH-GAN: Towards Sharp and Smooth Synthetic EHR Data Generation","Artificial Intelligence in Medicine","","","","10.1007/978-3-030-59137-3_4","Sina RashidianFusheng WangRichard MoffittVictor GarciaAnurag DuttWei ChangVishwam PandyaJanos HajagosMary SaltzJoel Saltz","2020","http://link.springer.com/chapter/10.1007/978-3-030-59137-3_4","Chapter"
"Threats to Federated Learning","Federated Learning","","","","10.1007/978-3-030-63076-8_1","Lingjuan LyuHan YuJun ZhaoQiang Yang","2020","http://link.springer.com/chapter/10.1007/978-3-030-63076-8_1","Chapter"
"Deep Leakage from Gradients","Federated Learning","","","","10.1007/978-3-030-63076-8_2","Ligeng ZhuSong Han","2020","http://link.springer.com/chapter/10.1007/978-3-030-63076-8_2","Chapter"
"Using argument schemes for hypothetical reasoning in law","Artificial Intelligence and Law","","18","2","10.1007/s10506-010-9094-8","Trevor Bench-CaponHenry Prakken","2010","http://link.springer.com/article/10.1007/s10506-010-9094-8","Article"
"Collaborative Learning Based Effective Malware Detection System","ECML PKDD 2020 Workshops","","","","10.1007/978-3-030-65965-3_13","Narendra SinghHarsh KasyapSomanath Tripathy","2020","http://link.springer.com/chapter/10.1007/978-3-030-65965-3_13","Chapter"
"CVNNs-IDS: Complex-Valued Neural Network Based In-Vehicle Intrusion Detection System","Security and Privacy in Digital Economy","","","","10.1007/978-981-15-9129-7_19","Mu HanPengzhou ChengShidian Ma","2020","http://link.springer.com/chapter/10.1007/978-981-15-9129-7_19","Chapter"
"IL4IoT: Incremental Learning for Internet-of-Things Devices","Ambient Intelligence","","","","10.1007/978-3-030-34255-5_7","Yuanyuan BaoWai Chen","2019","http://link.springer.com/chapter/10.1007/978-3-030-34255-5_7","Chapter"
"GAN-based synthetic brain PET image generation","Brain Informatics","","7","1","10.1186/s40708-020-00104-2","Jyoti IslamYanqing Zhang","2020","http://link.springer.com/article/10.1186/s40708-020-00104-2","Article"
"GAN-TStega: Text Steganography Based on Generative Adversarial Networks","Digital Forensics and Watermarking","","","","10.1007/978-3-030-43575-2_2","Zhongliang YangNan WeiQinghe LiuYongfeng HuangYujin Zhang","2020","http://link.springer.com/chapter/10.1007/978-3-030-43575-2_2","Chapter"
"Continuous Patient-Centric Sequence Generation via Sequentially Coupled Adversarial Learning","Database Systems for Advanced Applications","","","","10.1007/978-3-030-18579-4_3","Lu WangWei ZhangXiaofeng He","2019","http://link.springer.com/chapter/10.1007/978-3-030-18579-4_3","Chapter"
"Knowledge Distillation: A Survey","International Journal of Computer Vision","","","","10.1007/s11263-021-01453-z","Jianping GouBaosheng YuStephen J. MaybankDacheng Tao","2021","http://link.springer.com/article/10.1007/s11263-021-01453-z","Article"
"DeepPrivacy: A Generative Adversarial Network for Face Anonymization","Advances in Visual Computing","","","","10.1007/978-3-030-33720-9_44","Håkon HukkelåsRudolf MesterFrank Lindseth","2019","http://link.springer.com/chapter/10.1007/978-3-030-33720-9_44","Chapter"
"Using Generative Adversarial Networks to Develop a Realistic Human Behavior Simulator","PRIMA 2018: Principles and Practice of Multi-Agent Systems","","","","10.1007/978-3-030-03098-8_32","Ali el HassouniMark HoogendoornVesa Muhonen","2018","http://link.springer.com/chapter/10.1007/978-3-030-03098-8_32","Chapter"
"Multi-owner Secure Encrypted Search Using Searching Adversarial Networks","Cryptology and Network Security","","","","10.1007/978-3-030-31578-8_10","Kai ChenZhongrui LinJian WanLei XuChungen Xu","2019","http://link.springer.com/chapter/10.1007/978-3-030-31578-8_10","Chapter"
"The Chinese approach to artificial intelligence: an analysis of policy, ethics, and regulation","AI & SOCIETY","","36","1","10.1007/s00146-020-00992-2","Huw RobertsJosh CowlsJessica MorleyMariarosaria TaddeoVincent WangLuciano Floridi","2021","http://link.springer.com/article/10.1007/s00146-020-00992-2","Article"
"A review of generative adversarial networks and its application in cybersecurity","Artificial Intelligence Review","","53","3","10.1007/s10462-019-09717-4","Chika Yinka-BanjoOgban-Asuquo Ugot","2020","http://link.springer.com/article/10.1007/s10462-019-09717-4","Article"
"Robust, Imperceptible and End-to-End Audio Steganography Based on CNN","Security and Privacy in Digital Economy","","","","10.1007/978-981-15-9129-7_30","Jie WangRangding WangLi DongDiqun Yan","2020","http://link.springer.com/chapter/10.1007/978-981-15-9129-7_30","Chapter"
"GAN-Based Realistic Bone Ultrasound Image and Label Synthesis for Improved Segmentation","Medical Image Computing and Computer Assisted Intervention – MICCAI 2020","","","","10.1007/978-3-030-59725-2_77","Ahmed Z. AlsinanCharles RuleMichael VivesVishal M. PatelIlker Hacihaliloglu","2020","http://link.springer.com/chapter/10.1007/978-3-030-59725-2_77","Chapter"
"Augmenting Physiological Time Series Data: A Case Study for Sleep Apnea Detection","Machine Learning and Knowledge Discovery in Databases","","","","10.1007/978-3-030-46133-1_23","Konstantinos NikolaidisStein KristiansenVera GoebelThomas PlagemannKnut LiestølMohan Kankanhalli","2020","http://link.springer.com/chapter/10.1007/978-3-030-46133-1_23","Chapter"
"Generative Adversarial Networks (GANs) for Retinal Fundus Image Synthesis","Computer Vision – ACCV 2018 Workshops","","","","10.1007/978-3-030-21074-8_24","Valentina BellemoPhilippe BurlinaLiu YongTien Yin WongDaniel Shu Wei Ting","2019","http://link.springer.com/chapter/10.1007/978-3-030-21074-8_24","Chapter"
"Mobile Health ID Card","Software Technologies: Applications and Foundations","","","","10.1007/978-3-319-74730-9_35","Malgorzata Zofia GoraczekMichael SachsOliver TerbuLei ZhuBirgit ScholzGeorg Egger-SidloSebastian ZehetbauerStefan Vogl","2018","http://link.springer.com/chapter/10.1007/978-3-319-74730-9_35","Chapter"
"Deep learning for biomedical image reconstruction: a survey","Artificial Intelligence Review","","54","1","10.1007/s10462-020-09861-2","Hanene Ben YedderBen CardoenGhassan Hamarneh","2021","http://link.springer.com/article/10.1007/s10462-020-09861-2","Article"
"A Novel Intermediary Framework for Dynamic Edge Service Composition","Journal of Computer Science and Technology","","27","2","10.1007/s11390-012-1223-2","Claudia CanaliMichele ColajanniDelfina MalandrinoVittorio ScaranoRaffaele Spinelli","2012","http://link.springer.com/article/10.1007/s11390-012-1223-2","Article"
"Ambient Intelligence in the City Overview and New Perspectives","Handbook of Ambient Intelligence and Smart Environments","","","","10.1007/978-0-387-93808-0_34","Marc BöhlenHans Frei","2010","http://link.springer.com/chapter/10.1007/978-0-387-93808-0_34","Chapter"
"Improving Communication Efficiency for Encrypted Distributed Training","Security and Privacy in Digital Economy","","","","10.1007/978-981-15-9129-7_40","Minglu ZhangQixian ZhouShaopeng LiangHaomiao Yang","2020","http://link.springer.com/chapter/10.1007/978-981-15-9129-7_40","Chapter"
"On Identifying and Explaining Similarities in Android Apps","Journal of Computer Science and Technology","","34","2","10.1007/s11390-019-1918-8","Li LiTegawendé F. BissyandéHao-Yu WangJacques Klein","2019","http://link.springer.com/article/10.1007/s11390-019-1918-8","Article"
"Synthesis of Medical Images Using GANs","Uncertainty for Safe Utilization of Machine Learning in Medical Imaging and Clinical Image-Based Procedures","","","","10.1007/978-3-030-32689-0_13","Luise MiddelChristoph PalmMarius Erdt","2019","http://link.springer.com/chapter/10.1007/978-3-030-32689-0_13","Chapter"
"A Hybrid Model for Identity Obfuscation by Face Replacement","Computer Vision – ECCV 2018","","","","10.1007/978-3-030-01246-5_34","Qianru SunAyush TewariWeipeng XuMario FritzChristian TheobaltBernt Schiele","2018","http://link.springer.com/chapter/10.1007/978-3-030-01246-5_34","Chapter"
"On Secure e-Health Systems","Privacy in Statistical Databases","","","","10.1007/11930242_30","Milan Marković","2006","http://link.springer.com/chapter/10.1007/11930242_30","Chapter"
"Interpretable Encrypted Searchable Neural Networks","Machine Learning for Cyber Security","","","","10.1007/978-3-030-30619-9_20","Kai ChenZhongrui LinJian WanChungen Xu","2019","http://link.springer.com/chapter/10.1007/978-3-030-30619-9_20","Chapter"
"A Survey of Deep Facial Attribute Analysis","International Journal of Computer Vision","","128","8 - 9","10.1007/s11263-020-01308-z","Xin ZhengYanqing GuoHuaibo HuangYi LiRan He","2020","http://link.springer.com/article/10.1007/s11263-020-01308-z","Article"
"Generative Adversarial Network-Based Semi-supervised Learning for Pathological Speech Classification","Statistical Language and Speech Processing","","","","10.1007/978-3-030-59430-5_14","Nam H. TrinhDarragh O’Brien","2020","http://link.springer.com/chapter/10.1007/978-3-030-59430-5_14","Chapter"
"Unsupervised Human Pose Estimation on Depth Images","Machine Learning and Knowledge Discovery in Databases: Applied Data Science Track","","","","10.1007/978-3-030-67667-4_22","Thibault Blanc-BeyneAxel CarlierSandrine MouyssetVincent Charvillat","2021","http://link.springer.com/chapter/10.1007/978-3-030-67667-4_22","Chapter"
"A novel super-resolution CT image reconstruction via semi-supervised generative adversarial network","Neural Computing and Applications","","32","18","10.1007/s00521-020-04905-8","Xin JiangMingzhe LiuFeixiang ZhaoXianghe LiuHelen Zhou","2020","http://link.springer.com/article/10.1007/s00521-020-04905-8","Article"
"Twitter alloy steel disambiguation and user relevance via one-class and two-class news titles classifiers","Neural Computing and Applications","","33","4","10.1007/s00521-020-04991-8","Paola ZolaPaulo CortezEugenio Brentari","2021","http://link.springer.com/article/10.1007/s00521-020-04991-8","Article"
"SplitPass: A Mutually Distrusting Two-Party Password Manager","Journal of Computer Science and Technology","","33","1","10.1007/s11390-018-1810-y","Yu-Tao LiuDong DuYu-Bin XiaHai-Bo ChenBin-Yu ZangZhenkai Liang","2018","http://link.springer.com/article/10.1007/s11390-018-1810-y","Article"
"Comparative Feedback in the Street: Exposing Residential Energy Consumption on House Façades","Human-Computer Interaction – INTERACT 2011","","","","10.1007/978-3-642-23774-4_39","Andrew Vande MoereMartin TomitschMonika HoinkisElmar TrefzSilje JohansenAllison Jones","2011","http://link.springer.com/chapter/10.1007/978-3-642-23774-4_39","Chapter"
"Classifying Security Attacks in IoT Using CTM Method","Emerging Trends in ICT for Sustainable Development","","","","10.1007/978-3-030-53440-0_32","Hind MezianeNoura OuerdiMohammed Amine KasmiSanae Mazouz","2021","http://link.springer.com/chapter/10.1007/978-3-030-53440-0_32","Chapter"
"A Novel Security Architecture for Biometric Templates Using Visual Cryptography and Chaotic Image Encryption","Eco-friendly Computing and Communication Systems","","","","10.1007/978-3-642-32112-2_29","Divya JamesMintu Philip","2012","http://link.springer.com/chapter/10.1007/978-3-642-32112-2_29","Chapter"
"Spatiotemporal data mining: a survey on challenges and open problems","Artificial Intelligence Review","","","","10.1007/s10462-021-09994-y","Ali HamdiKhaled ShabanAbdelkarim ErradiAmr MohamedShakila Khan RumiFlora D. Salim","2021","http://link.springer.com/article/10.1007/s10462-021-09994-y","Article"
"Data mining and knowledge discovery in business databases","Foundations of Intelligent Systems","","","","10.1007/3-540-61286-6_131","Gregory Piatetsky-Shapiro","1996","http://link.springer.com/chapter/10.1007/3-540-61286-6_131","Chapter"
"TICS: text–image-based semantic CAPTCHA synthesis via multi-condition adversarial learning","The Visual Computer","","","","10.1007/s00371-021-02061-1","Xinkang JiaJun XiaoChao Wu","2021","http://link.springer.com/article/10.1007/s00371-021-02061-1","Article"
"Conditional Infilling GANs for Data Augmentation in Mammogram Classification","Image Analysis for Moving Organ, Breast, and Thoracic Images","","","","10.1007/978-3-030-00946-5_11","Eric WuKevin WuDavid CoxWilliam Lotter","2018","http://link.springer.com/chapter/10.1007/978-3-030-00946-5_11","Chapter"
