Item Title,Publication Title,Book Series Title,Journal Volume,Journal Issue,Item DOI,Authors,Publication Year,URL,Content Type
"Further Results on Bent–Negabent Boolean Functions","Security and Privacy","","","","10.1007/978-981-33-6781-4_5","Sihem MesnagerBachir ben MoussatZepeng Zhuo","2021","http://link.springer.com/chapter/10.1007/978-981-33-6781-4_5","Chapter"
"Efficient Maliciously Secure Multiparty Computation for RAM","Advances in Cryptology – EUROCRYPT 2018","","","","10.1007/978-3-319-78372-7_4","Marcel KellerAvishay Yanai","2018","http://link.springer.com/chapter/10.1007/978-3-319-78372-7_4","Chapter"
"Post-Quantum Secure Identity-Based Encryption from Multivariate Public Key Cryptography","Security and Privacy","","","","10.1007/978-981-33-6781-4_12","Nibedita KunduKunal DeyPantelimon StănicăSumit Kumar DebnathSaibal Kumar Pal","2021","http://link.springer.com/chapter/10.1007/978-981-33-6781-4_12","Chapter"
"Research on the Security Protection Scheme for Container-Based Cloud Platform Node Based on BlockChain Technology","Data Science","","","","10.1007/978-981-13-2203-7_3","Xiaolan XieTao HuangZhihong Guo","2018","http://link.springer.com/chapter/10.1007/978-981-13-2203-7_3","Chapter"
"Laplacian Spectrum Learning","Machine Learning and Knowledge Discovery in Databases","","","","10.1007/978-3-642-15939-8_17","Pannagadatta K. ShivaswamyTony Jebara","2010","http://link.springer.com/chapter/10.1007/978-3-642-15939-8_17","Chapter"
"Case Studies in Retail AI","Machine Learning Applications Using Python","","","","10.1007/978-1-4842-3787-8_10","Puneet Mathur","2019","http://link.springer.com/chapter/10.1007/978-1-4842-3787-8_10","Chapter"
"A Kinect-Based Gesture Acquisition and Reproduction System for Humanoid Robots","Computational Science and Its Applications – ICCSA 2020","","","","10.1007/978-3-030-58799-4_69","Agnese AugelloAngelo CiullaAlfredo CuzzocreaSalvatore GaglioGiovanni PilatoFilippo Vella","2020","http://link.springer.com/chapter/10.1007/978-3-030-58799-4_69","Chapter"
"The Role of Deep Learning in Improving Healthcare","Data Science for Healthcare","","","","10.1007/978-3-030-05249-2_3","Stefan ThalerVlado Menkovski","2019","http://link.springer.com/chapter/10.1007/978-3-030-05249-2_3","Chapter"
"Unsupervised Anomaly Detection of Healthcare Providers Using Generative Adversarial Networks","Responsible Design, Implementation and Use of Information and Communication Technology","","","","10.1007/978-3-030-44999-5_35","Krishnan NaidooVukosi Marivate","2020","http://link.springer.com/chapter/10.1007/978-3-030-44999-5_35","Chapter"
"Deep Learning Development Status in China","The Development of Deep Learning Technologies","","","","10.1007/978-981-15-4584-9_2","","2020","http://link.springer.com/chapter/10.1007/978-981-15-4584-9_2","Chapter"
"Analyzing the Footprint of Classifiers in Adversarial Denial of Service Contexts","Progress in Artificial Intelligence","","","","10.1007/978-3-030-30244-3_22","Nuno MartinsJosé Magalhães CruzTiago CruzPedro Henriques Abreu","2019","http://link.springer.com/chapter/10.1007/978-3-030-30244-3_22","Chapter"
"Synthesizing New Retinal Symptom Images by Multiple Generative Models","Computer Vision – ACCV 2018 Workshops","","","","10.1007/978-3-030-21074-8_19","Yi-Chieh LiuHao-Hsiang YangC.-H. Huck YangJia-Hong HuangMeng TianHiromasa MorikawaYi-Chang James TsaiJesper Tegnèr","2019","http://link.springer.com/chapter/10.1007/978-3-030-21074-8_19","Chapter"
"Generating Human Action Videos by Coupling 3D Game Engines and Probabilistic Graphical Models","International Journal of Computer Vision","","128","5","10.1007/s11263-019-01222-z","César Roberto de SouzaAdrien GaidonYohann CabonNaila MurrayAntonio Manuel López","2020","http://link.springer.com/article/10.1007/s11263-019-01222-z","Article"
"Ask, Acquire, and Attack: Data-Free UAP Generation Using Class Impressions","Computer Vision – ECCV 2018","","","","10.1007/978-3-030-01240-3_2","Konda Reddy MopuriPhani Krishna UppalaR. Venkatesh Babu","2018","http://link.springer.com/chapter/10.1007/978-3-030-01240-3_2","Chapter"
"OpenAdap.net: Evolvable Information Processing Environment","Applications of Fuzzy Sets Theory","","","","10.1007/978-3-540-73400-0_28","Alessandro E. P. VillaJavier Iglesias","2007","http://link.springer.com/chapter/10.1007/978-3-540-73400-0_28","Chapter"
"A divide-and-unite deep network for person re-identification","Applied Intelligence","","51","3","10.1007/s10489-020-01880-4","Rui LiBaopeng ZhangZhu TengJianping Fan","2021","http://link.springer.com/article/10.1007/s10489-020-01880-4","Article"
"Maximal Association Rules: A Tool for Mining Associations in Text","Journal of Intelligent Information Systems","","25","3","10.1007/s10844-005-0196-9","Amihood AmirYonatan AumannRonen FeldmanMoshe Fresko","2005","http://link.springer.com/article/10.1007/s10844-005-0196-9","Article"
"Fast Distributed RSA Key Generation for Semi-honest and Malicious Adversaries","Advances in Cryptology – CRYPTO 2018","","","","10.1007/978-3-319-96881-0_12","Tore Kasper FrederiksenYehuda LindellValery OsheterBenny Pinkas","2018","http://link.springer.com/chapter/10.1007/978-3-319-96881-0_12","Chapter"
"Mining Correlation Relationship of Users from Trajectory Data","Data Science","","","","10.1007/978-981-13-2203-7_23","Zi YangBo Ning","2018","http://link.springer.com/chapter/10.1007/978-981-13-2203-7_23","Chapter"
"SpOT-Light: Lightweight Private Set Intersection from Sparse OT Extension","Advances in Cryptology – CRYPTO 2019","","","","10.1007/978-3-030-26954-8_13","Benny PinkasMike RosulekNi TrieuAvishay Yanai","2019","http://link.springer.com/chapter/10.1007/978-3-030-26954-8_13","Chapter"
"Towards User-in-the-Loop Online Fashion Size Recommendation with Low Cognitive Load","Recommender Systems in Fashion and Retail","","","","10.1007/978-3-030-66103-8_4","Leonidas LefakisEvgenii KoriaginJulia LasserreReza Shirvany","2021","http://link.springer.com/chapter/10.1007/978-3-030-66103-8_4","Chapter"
"Virtual City Simulator for Education, Training, and Guidance","Monitoring, Security, and Rescue Techniques in Multiagent Systems","","","","10.1007/3-540-32370-8_33","Hideyuki Nakanishi","2005","http://link.springer.com/chapter/10.1007/3-540-32370-8_33","Chapter"
"Capturing User Interests by Both Exploitation and Exploration","User Modeling 2007","","","","10.1007/978-3-540-73078-1_40","Ka Cheung SiaShenghuo ZhuYun ChiKoji HinoBelle L. Tseng","2007","http://link.springer.com/chapter/10.1007/978-3-540-73078-1_40","Chapter"
"From Learner Information Packages to Student Models: Which Continuum?","Intelligent Tutoring Systems","","","","10.1007/11774303_29","Lahcen OubahssiMonique Grandbastien","2006","http://link.springer.com/chapter/10.1007/11774303_29","Chapter"
"A Fuzzy-Based Dynamic Provision Approach for Virtualized Network Intrusion Detection Systems","Advances in Computer Science and Information Technology","","","","10.1007/978-3-642-13577-4_10","Bo LiJianxin LiTianyu WoXudong WuJunaid ArshadWantao Liu","2010","http://link.springer.com/chapter/10.1007/978-3-642-13577-4_10","Chapter"
"Mutual Authentication Protocol Based on Smart Card and Combined Secret Key Encryption","Advances in Swarm and Computational Intelligence","","","","10.1007/978-3-319-20472-7_15","Guifen ZhaoLiping DuYing LiGuanning Xu","2015","http://link.springer.com/chapter/10.1007/978-3-319-20472-7_15","Chapter"
"Determining the Link and Rate Popularity of Enterprise Process Information","On the Move to Meaningful Internet Systems: OTM 2013 Conferences","","","","10.1007/978-3-642-41030-7_8","Bernd MichelbergerBela MutschlerMarkus HippManfred Reichert","2013","http://link.springer.com/chapter/10.1007/978-3-642-41030-7_8","Chapter"
"MobiSoft: Networked Personal Assistants for Mobile Users in Everyday Life","Cooperative Information Agents XII","","","","10.1007/978-3-540-85834-8_13","Christian ErfurthSteffen KernWilhelm RossakPeter BraunAntje Leßmann","2008","http://link.springer.com/chapter/10.1007/978-3-540-85834-8_13","Chapter"
"Context-Aware Personal Route Recognition","Discovery Science","","","","10.1007/978-3-642-24477-3_19","Oleksiy MazhelisIndrė ŽliobaitėMykola Pechenizkiy","2011","http://link.springer.com/chapter/10.1007/978-3-642-24477-3_19","Chapter"
"Computing with Idiotypic Networks","Intelligent Information Processing and Web Mining","","","","10.1007/3-540-32392-9_80","Francisco MartinsNeva Slani","2005","http://link.springer.com/chapter/10.1007/3-540-32392-9_80","Chapter"
"Relationships between Blogging Activeness and the Characteristics of Participants and Blogs during Teaching Practice and Induction Year","Advances in Web-Based Learning – ICWL 2014","","","","10.1007/978-3-319-09635-3_2","Piret LuikMerle Taimalu","2014","http://link.springer.com/chapter/10.1007/978-3-319-09635-3_2","Chapter"
"SpeakUp – A Mobile App Facilitating Audience Interaction","Advances in Web-Based Learning – ICWL 2013","","","","10.1007/978-3-642-41175-5_2","Adrian HolzerSten GovaertsJan OndrusAndrii VozniukDavid RigaudBenoît GarbinatoDenis Gillet","2013","http://link.springer.com/chapter/10.1007/978-3-642-41175-5_2","Chapter"
"Human Factors Consideration for the Design of Collaborative Machine Assistants","Handbook of Ambient Intelligence and Smart Environments","","","","10.1007/978-0-387-93808-0_36","Sung ParkArthur D. FiskWendy A. Rogers","2010","http://link.springer.com/chapter/10.1007/978-0-387-93808-0_36","Chapter"
"The AI Landscape","Implementing AI Systems","","","","10.1007/978-1-4842-6385-3_1","Tom Taulli","2021","http://link.springer.com/chapter/10.1007/978-1-4842-6385-3_1","Chapter"
"Towards an Internetworked Enterprise: some issues to be discussed","Evolving Towards the Internetworked Enterprise","","","","10.1007/978-1-4419-7279-8_1","Giuseppina Passiante","2010","http://link.springer.com/chapter/10.1007/978-1-4419-7279-8_1","Chapter"
"A Novel Model of Artificial Immune System for Solving Constrained Optimization Problems with Dynamic Tolerance Factor","MICAI 2007: Advances in Artificial Intelligence","","","","10.1007/978-3-540-76631-5_3","Victoria S. AragónSusana C. EsquivelCarlos A. Coello Coello","2007","http://link.springer.com/chapter/10.1007/978-3-540-76631-5_3","Chapter"
"Applications of Outlier Analysis","Outlier Analysis","","","","10.1007/978-1-4614-6396-2_12","Charu C. Aggarwal","2013","http://link.springer.com/chapter/10.1007/978-1-4614-6396-2_12","Chapter"
"An Ant Colony Optimization Algorithm for an Automatic Categorization of Emails","Computational Collective Intelligence. Technologies and Applications","","","","10.1007/978-3-319-11289-3_59","Urszula BoryczkaBarbara ProbierzJan Kozak","2014","http://link.springer.com/chapter/10.1007/978-3-319-11289-3_59","Chapter"
"Structured Data Extraction: Wrapper Generation","Web Data Mining","","","","10.1007/978-3-540-37882-2_9","","2007","http://link.springer.com/chapter/10.1007/978-3-540-37882-2_9","Chapter"
"Frontal-Standing Pose Based Person Identification Using Kinect","Human-Computer Interaction. Advanced Interaction Modalities and Techniques","","","","10.1007/978-3-319-07230-2_21","Kingshuk ChakravartyTanushyam Chattopadhyay","2014","http://link.springer.com/chapter/10.1007/978-3-319-07230-2_21","Chapter"
"Contextual Factors in Database Integration — A Delphi Study","Conceptual Modeling – ER 2010","","","","10.1007/978-3-642-16373-9_20","Joerg Evermann","2010","http://link.springer.com/chapter/10.1007/978-3-642-16373-9_20","Chapter"
"Home Is Where Your Phone Is: Usability Evaluation of Mobile Phone UI for a Smart Home","Mobile Human-Computer Interaction - MobileHCI 2004","","","","10.1007/978-3-540-28637-0_7","Tiiu KoskelaKaisa Väänänen-Vainio-MattilaLauri Lehti","2004","http://link.springer.com/chapter/10.1007/978-3-540-28637-0_7","Chapter"
"Group Preferences for Query Answering in Datalog+/- Ontologies","Scalable Uncertainty Management","","","","10.1007/978-3-642-40381-1_28","Thomas LukasiewiczMaria Vanina MartinezGerardo I. SimariOana Tifrea-Marciuska","2013","http://link.springer.com/chapter/10.1007/978-3-642-40381-1_28","Chapter"
"Context Cookies","Knowledge-Based Intelligent Information and Engineering Systems","","","","10.1007/978-3-540-85563-7_95","Ramón HervásGabriel ChaviraSalvador W. NavaVladimir VillarrealJosé Bravo","2008","http://link.springer.com/chapter/10.1007/978-3-540-85563-7_95","Chapter"
"Who Should Be Invited to My Party: A Size-Constrained k-Core Problem in Social Networks","Journal of Computer Science and Technology","","34","1","10.1007/s11390-019-1905-0","Yu-Liang MaYe YuanFei-Da ZhuGuo-Ren WangJing XiaoJian-Zong Wang","2019","http://link.springer.com/article/10.1007/s11390-019-1905-0","Article"
"Weighted Angle Based Approach for Face Recognition","Advances in Computer Science and Information Technology. Networks and Communications","","","","10.1007/978-3-642-27299-8_34","M. Koteswara RaoK. VeeraswamyK. Anitha SheelaB. Chandra Mohan","2012","http://link.springer.com/chapter/10.1007/978-3-642-27299-8_34","Chapter"
"Analyzing Location Predictability on Location-Based Social Networks","Advances in Knowledge Discovery and Data Mining","","","","10.1007/978-3-319-06608-0_9","Defu LianYin ZhuXing XieEnhong Chen","2014","http://link.springer.com/chapter/10.1007/978-3-319-06608-0_9","Chapter"
"Multimodal Approaches in Analysing and Interpreting Big Social Media Data","Multimodal Analytics for Next-Generation Big Data Technologies and Applications","","","","10.1007/978-3-319-97598-6_15","Eugene Ch’ngMengdi LiZiyang ChenJingbo LangSimon See","2019","http://link.springer.com/chapter/10.1007/978-3-319-97598-6_15","Chapter"
"Optimal Broadcast in Shared Spectrum Radio Networks","Principles of Distributed Systems","","","","10.1007/978-3-642-35476-2_13","Mohsen GhaffariSeth GilbertCalvin NewportHenry Tan","2012","http://link.springer.com/chapter/10.1007/978-3-642-35476-2_13","Chapter"
"Low redundancy polynomial checks for numerical computation","Applicable Algebra in Engineering, Communication and Computing","","7","6","10.1007/BF01293262","F. S. Vainstein","1996","http://link.springer.com/article/10.1007/BF01293262","Article"
"Towards Unified Provenance Granularities","Provenance and Annotation of Data and Processes","","","","10.1007/978-3-642-34222-6_4","Timothy LeboPing WangAlvaro GravesDeborah L. McGuinness","2012","http://link.springer.com/chapter/10.1007/978-3-642-34222-6_4","Chapter"
"Secrecy Preserving BDI Agents Based on Answerset Programming","Multiagent System Technologies","","","","10.1007/978-3-642-40776-5_13","Patrick KrümpelmannGabriele Kern-Isberner","2013","http://link.springer.com/chapter/10.1007/978-3-642-40776-5_13","Chapter"
"Trafficopter: A distributed collection system for traffic information","Cooperative Information Agents II Learning, Mobility and Electronic Commerce for Information Discovery on the Internet","","","","10.1007/BFb0053673","Alexandras MoukasKonstantinos ChandrinosPattie Maes","1998","http://link.springer.com/chapter/10.1007/BFb0053673","Chapter"
"XG: A Data-Driven Computation Grid for Enterprise-Scale Mining","Database and Expert Systems Applications","","","","10.1007/11546924_81","Radu SionRamesh NatarajanInderpal NarangWen-Syan LiThomas Phan","2005","http://link.springer.com/chapter/10.1007/11546924_81","Chapter"
"Handwriting Biometrics: Feature Selection Based Improvements in Authentication and Hash Generation Accuracy","Biometrics and ID Management","","","","10.1007/978-3-642-19530-3_4","Andrey MakrushinTobias ScheidatClaus Vielhauer","2011","http://link.springer.com/chapter/10.1007/978-3-642-19530-3_4","Chapter"
"Changing the Model in Pharma and Healthcare – Can We Afford to Wait Any Longer?","Data Integration in the Life Sciences","","","","10.1007/978-3-642-39437-9_1","Erich Alfred Gombocz","2013","http://link.springer.com/chapter/10.1007/978-3-642-39437-9_1","Chapter"
"Agent-Mining Interaction: An Emerging Area","Autonomous Intelligent Systems: Multi-Agents and Data Mining","","","","10.1007/978-3-540-72839-9_5","Longbing CaoChao LuoChengqi Zhang","2007","http://link.springer.com/chapter/10.1007/978-3-540-72839-9_5","Chapter"
"Achieving Fairness with Decision Trees: An Adversarial Approach","Data Science and Engineering","","5","2","10.1007/s41019-020-00124-2","Vincent GrariBoris RufSylvain LamprierMarcin Detyniecki","2020","http://link.springer.com/article/10.1007/s41019-020-00124-2","Article"
"Machine Learning – The Results Are Not the only Thing that Matters! What About Security, Explainability and Fairness?","Computational Science – ICCS 2020","","","","10.1007/978-3-030-50423-6_46","Michał ChoraśMarek PawlickiDamian PuchalskiRafał Kozik","2020","http://link.springer.com/chapter/10.1007/978-3-030-50423-6_46","Chapter"
"A Multi-view Learning Approach to the Discovery of Deviant Process Instances","On the Move to Meaningful Internet Systems: OTM 2015 Conferences","","","","10.1007/978-3-319-26148-5_9","Alfredo CuzzocreaFrancesco FolinoMassimo GuarascioLuigi Pontieri","2015","http://link.springer.com/chapter/10.1007/978-3-319-26148-5_9","Chapter"
"High-Voltage Equipment Monitoring System Based on IOT","Wireless Communications and Applications","","","","10.1007/978-3-642-29157-9_5","Ye CaiXiao-Qin HuangJie He","2012","http://link.springer.com/chapter/10.1007/978-3-642-29157-9_5","Chapter"
"Detection of Polymorphic Viruses in Windows Executables","Contemporary Computing","","","","10.1007/978-3-642-14825-5_11","Abhiram KasinaAmit SutharRajeev Kumar","2010","http://link.springer.com/chapter/10.1007/978-3-642-14825-5_11","Chapter"
"Lessons from the Application of Domain-Independent Data Mining System for Discovering Web User Access Patterns","Knowledge-Based Intelligent Information and Engineering Systems","","","","10.1007/11893011_100","Leszek BorzemskiAdam Druszcz","2006","http://link.springer.com/chapter/10.1007/11893011_100","Chapter"
"Characterization of Individual Mobility for Non-routine Scenarios from Crowd Sensing and Clustered Data","Ambient Intelligence","","","","10.1007/978-3-030-34255-5_20","Inês CunhaJoão SimõesAna AlvesRui GomesAnabela Ribeiro","2019","http://link.springer.com/chapter/10.1007/978-3-030-34255-5_20","Chapter"
"DDNE: Discriminative Distance Metric Learning for Network Embedding","Computational Science – ICCS 2020","","","","10.1007/978-3-030-50371-0_42","Xiaoxue LiYangxi LiYanmin ShangLingling TongFang FangPengfei YinJie ChengJing Li","2020","http://link.springer.com/chapter/10.1007/978-3-030-50371-0_42","Chapter"
"Collaborative Filtering for Estimating Health Related Utilities in Decision Support Systems","Artificial Intelligence in Medicine","","","","10.1007/978-3-319-19551-3_13","Enea ParimbelliSilvana QuagliniRiccardo BellazziJohn H. Holmes","2015","http://link.springer.com/chapter/10.1007/978-3-319-19551-3_13","Chapter"
"StarGAN-ZSVC: Towards Zero-Shot Voice Conversion in Low-Resource Contexts","Artificial Intelligence Research","","","","10.1007/978-3-030-66151-9_5","Matthew BaasHerman Kamper","2020","http://link.springer.com/chapter/10.1007/978-3-030-66151-9_5","Chapter"
"A smart anomaly-based intrusion detection system for the Internet of Things (IoT) network using GWO–PSO–RF model","Journal of Reliable Intelligent Environments","","7","1","10.1007/s40860-020-00126-x","Pankaj Kumar KeserwaniMahesh Chandra GovilEmmanuel S. PilliPrajjval Govil","2021","http://link.springer.com/article/10.1007/s40860-020-00126-x","Article"
"Target Track Recognition from Few-Labeled Radar Data with Outliers","Urban Intelligence and Applications","","","","10.1007/978-981-33-4601-7_21","Yuqi FanGuangming ShenXiaohui YuanJuan Xu","2020","http://link.springer.com/chapter/10.1007/978-981-33-4601-7_21","Chapter"
"Prospero’s Books: A Distributed Architecture for AI","Distributed Computing and Internet Technology","","","","10.1007/978-3-030-36987-3_3","Bhubaneswar (Bud) Mishra","2020","http://link.springer.com/chapter/10.1007/978-3-030-36987-3_3","Chapter"
"Missing Value Imputation for the Analysis of Incomplete Traffic Accident Data","Machine Learning and Cybernetics","","","","10.1007/978-3-662-45652-1_28","Rupam DebAlan Wee-chung Liew","2014","http://link.springer.com/chapter/10.1007/978-3-662-45652-1_28","Chapter"
"AI Supervision with a Red Team","Keeping Your AI Under Control","","","","10.1007/978-1-4842-5467-7_9","Anand Tamboli","2019","http://link.springer.com/chapter/10.1007/978-1-4842-5467-7_9","Chapter"
"Towards a Typology of Intentionally Inaccurate Representations of Reality in Media Content","Human-Centric Computing in a Data-Driven Society","","","","10.1007/978-3-030-62803-1_23","Matthew J. DavisPer Fors","2020","http://link.springer.com/chapter/10.1007/978-3-030-62803-1_23","Chapter"
"Implementation of Access Control Model for Distributed Information Systems Using Usage Control","Security and Intelligent Information Systems","","","","10.1007/978-3-642-25261-7_5","Aneta Poniszewska-Maranda","2012","http://link.springer.com/chapter/10.1007/978-3-642-25261-7_5","Chapter"
"Intelligent Hybrid Anomaly Network Intrusion Detection System","Communication and Networking","","","","10.1007/978-3-642-27192-2_25","Heba F. EidAshraf DarwishAboul Ella HassanienTai-hoon Kim","2012","http://link.springer.com/chapter/10.1007/978-3-642-27192-2_25","Chapter"
"Managing COPD Exacerbations with Telemedicine","Artificial Intelligence in Medicine","","","","10.1007/978-3-642-22218-4_21","Maarten van der HeijdenBas LijnsePeter J. F. LucasYvonne F. HeijdraTjard R. J. Schermer","2011","http://link.springer.com/chapter/10.1007/978-3-642-22218-4_21","Chapter"
"Defense–in–Depth Strategy for Smart Service Sever Cyber Security","Computer Applications for Communication, Networking, and Digital Contents","","","","10.1007/978-3-642-35594-3_26","Hanseong SonSoongohn Kim","2012","http://link.springer.com/chapter/10.1007/978-3-642-35594-3_26","Chapter"
"Strategies for a Creative Future with Computer Science, Quality Design and Communicability","Human-Computer Interaction, Tourism and Cultural Heritage","","","","10.1007/978-3-642-18348-5_6","Francisco V. Cipolla FicarraMaria Villarreal","2011","http://link.springer.com/chapter/10.1007/978-3-642-18348-5_6","Chapter"
"Deep Semi-supervised Segmentation with Weight-Averaged Consistency Targets","Deep Learning in Medical Image Analysis and Multimodal Learning for Clinical Decision Support","","","","10.1007/978-3-030-00889-5_2","Christian S. PeroneJulien Cohen-Adad","2018","http://link.springer.com/chapter/10.1007/978-3-030-00889-5_2","Chapter"
"SCAN: Structure Correcting Adversarial Network for Organ Segmentation in Chest X-Rays","Deep Learning in Medical Image Analysis and Multimodal Learning for Clinical Decision Support","","","","10.1007/978-3-030-00889-5_30","Wei DaiNanqing DongZeya WangXiaodan LiangHao ZhangEric P. Xing","2018","http://link.springer.com/chapter/10.1007/978-3-030-00889-5_30","Chapter"
"Logical Approaches to Incomplete Information: A Survey","Logics for Databases and Information Systems","","","","10.1007/978-1-4615-5643-5_10","Ron van der Meyden","1998","http://link.springer.com/chapter/10.1007/978-1-4615-5643-5_10","Chapter"
"Metacluster-based Projective Clustering Ensembles","Machine Learning","","98","1 - 2","10.1007/s10994-013-5395-y","Francesco GulloCarlotta DomeniconiAndrea Tagarelli","2015","http://link.springer.com/article/10.1007/s10994-013-5395-y","Article"
"Semantic Link Network for Understanding and Representing Reality in 
          Cyber-Physical-Social Space—A Model for Managing COVID-19 Pandemic","Cyber-Physical-Social Intelligence","","","","10.1007/978-981-13-7311-4_10","Hai Zhuge","2020","http://link.springer.com/chapter/10.1007/978-981-13-7311-4_10","Chapter"
"Efficient Visual Recognition","International Journal of Computer Vision","","128","8 - 9","10.1007/s11263-020-01351-w","Li LiuMatti PietikäinenJie QinWanli OuyangLuc Van Gool","2020","http://link.springer.com/article/10.1007/s11263-020-01351-w","Article"
"Communicating Is Crowdsourcing: Wi-Fi Indoor Localization with CSI-Based Speed Estimation","Journal of Computer Science and Technology","","29","4","10.1007/s11390-014-1452-7","Zhi-Ping JiangWei XiXiangyang LiShaojie TangJi-Zhong ZhaoJin-Song HanKun ZhaoZhi WangBo Xiao","2014","http://link.springer.com/article/10.1007/s11390-014-1452-7","Article"
"Personalization Models for Human Activity Recognition with Distribution Matching-Based Metrics","Deep Learning for Human Activity Recognition","","","","10.1007/978-981-16-0575-8_4","Huy Thong NguyenHyeokhyen KwonHarish HaresamudramAndrew F. PetersonThomas Plötz","2021","http://link.springer.com/chapter/10.1007/978-981-16-0575-8_4","Chapter"
"Design of a concurrent agent-oriented language","Intelligent Agents","","","","10.1007/3-540-58855-8_25","Devindra WeerasooriyaAnand RaoKotagiri Ramamohanarao","1995","http://link.springer.com/chapter/10.1007/3-540-58855-8_25","Chapter"
"Intrusion Detection Based on Dynamic Self-organizing Map Neural Network Clustering","Advances in Neural Networks – ISNN 2005","","","","10.1007/11427469_69","Yong FengKaigui WuZhongfu WuZhongyang Xiong","2005","http://link.springer.com/chapter/10.1007/11427469_69","Chapter"
"Application of deep learning in detecting neurological disorders from magnetic resonance images: a survey on the detection of Alzheimer’s disease, Parkinson’s disease and schizophrenia","Brain Informatics","","7","1","10.1186/s40708-020-00112-2","Manan Binth Taj NoorNusrat Zerin ZeniaM Shamim KaiserShamim Al MamunMufti Mahmud","2020","http://link.springer.com/article/10.1186/s40708-020-00112-2","Article"
"Adversarial Autoencoder and Multi-Task Semi-Supervised Learning for Multi-stage Process","Advances in Knowledge Discovery and Data Mining","","","","10.1007/978-3-030-47436-2_1","Andre MendesJulian TogeliusLeandro dos Santos Coelho","2020","http://link.springer.com/chapter/10.1007/978-3-030-47436-2_1","Chapter"
